{
  "id": "gel-alignment-policy",
  "artifact": "policies/alignment-policy.yaml",
  "artifact_type": "policy",
  "metrics": {
    "citation_count": 44,
    "violation_count": 0,
    "compliance_rate": 1.0,
    "last_cited": "2026-10-02T20:05:16Z",
    "last_violated": null,
    "promotion_candidate": true,
    "deprecation_candidate": false,
    "citation_rebaseline": "streeling-moved-to-learn",
    "citation_source": "git-grep-v1"
  },
  "events": [
    {
      "type": "created",
      "context": "Alignment policy established — confidence thresholds, intent verification, escalation triggers",
      "timestamp": "2026-03-14T00:00:00Z"
    },
    {
      "type": "cited",
      "context": "Used in every reconnaissance Tier 3 situational analysis for confidence gating",
      "timestamp": "2026-03-17T20:00:00Z"
    }
  ],
  "assessment": {
    "effectiveness": {
      "proposition": "The alignment policy effectively gates autonomous actions via confidence thresholds",
      "truth_value": "T",
      "confidence": 0.85
    },
    "recommendation": "maintain"
  },
  "created_at": "2026-03-17T20:00:00Z",
  "last_updated": "2026-03-17T20:00:00Z"
}
