{
  "id": "gel-governance-evolution-schema-2026-07-25",
  "artifact": "logic/governance-evolution.schema.json",
  "artifact_type": "schema",
  "metrics": {
    "citation_count": 17,
    "violation_count": 0,
    "compliance_rate": 0.0,
    "last_cited": "2026-09-13T14:18:51Z",
    "last_violated": null,
    "promotion_candidate": false,
    "deprecation_candidate": false,
    "citation_source": "git-grep-v1"
  },
  "events": [
    {
      "type": "gap_identified",
      "context": "/demerzel audit level 2 (check audit-2-4): assessment.effectiveness $ref targeted https://github.com/GuitarAlchemist/Demerzel/schemas/logic/tetravalent-state, but the tetravalent-state schema declares $id https://github.com/GuitarAlchemist/Demerzel/schemas/tetravalent-state (no /logic/ segment). All other logic schemas that reference tetravalent-state use the /schemas/ form, making this the lone inconsistent reference. The reference would not resolve when the schema is loaded by $id.",
      "timestamp": "2026-07-25T00:00:00Z"
    },
    {
      "type": "amended",
      "context": "Changed the $ref in logic/governance-evolution.schema.json from /schemas/logic/tetravalent-state to /schemas/tetravalent-state. Schema now compiles and the $ref resolves; sample evolution record validates assessment.effectiveness without $ref errors.",
      "timestamp": "2026-07-25T00:00:00Z"
    }
  ],
  "assessment": {
    "effectiveness": {
      "proposition": "logic/governance-evolution.schema.json has resolvable internal $refs and no dangling cross-schema references",
      "truth_value": "P",
      "confidence": 0.85
    },
    "recommendation": "maintain"
  },
  "created_at": "2026-07-25T00:00:00Z",
  "last_updated": "2026-07-25T00:00:00Z"
}
