{
  "id": "gel-kaizen-pdca-schema-2026-07-25",
  "artifact": "logic/kaizen-pdca-state.schema.json",
  "artifact_type": "schema",
  "metrics": {
    "citation_count": 13,
    "violation_count": 0,
    "compliance_rate": 0.0,
    "last_cited": "2026-09-12T17:51:01Z",
    "last_violated": null,
    "promotion_candidate": false,
    "deprecation_candidate": false,
    "citation_source": "git-grep-v1"
  },
  "events": [
    {
      "type": "gap_identified",
      "context": "/demerzel audit level 1 (check audit-1-3): all 8 state/pdca/*.pdca.json instances fail validation. Instances use cycle_phase/hypothesis/plan/do/check/kaizen_kind; schema requires proposition/model/phase/belief_state/iterations. Schema has drifted from the real instances — the 'schema-follows-reality' discipline (pdca-evolution-schema-follows-reality, 2026-05-01) was applied to governance-evolution.schema.json but never to this schema.",
      "timestamp": "2026-07-25T00:00:00Z"
    },
    {
      "type": "amended",
      "context": "Reconciled logic/kaizen-pdca-state.schema.json to real instance shape via schema-follows-reality. Required fields now: id, cycle_phase, hypothesis. Added kaizen_kind, work_type, source_cycle, experiment, requires_human_approval, evaluated_by, and structured plan/do/check/act objects. All 8 state/pdca/*.pdca.json instances now validate successfully.",
      "timestamp": "2026-07-25T00:00:00Z"
    }
  ],
  "assessment": {
    "effectiveness": {
      "proposition": "logic/kaizen-pdca-state.schema.json accurately describes the PDCA state instances it governs",
      "truth_value": "P",
      "confidence": 0.85
    },
    "recommendation": "maintain"
  },
  "created_at": "2026-07-25T00:00:00Z",
  "last_updated": "2026-07-25T00:00:00Z"
}
